{
  "$schema": "https://json-schema.org/draft/2020-12/schema",
  "$id": "https://raw.githubusercontent.com/navikt/copilot/main/apps/copilot-survey/surveys/schema.json",
  "schema_version": 5,
  "title": "copilot-survey survey definition",
  "description": "One survey, as a file in apps/copilot-survey/surveys/ and as an item of GET /api/v1/surveys/active. schema_version goes up on every change to the format. New fields are optional, so a client built against an older version keeps working: it ignores fields it does not know, and skips a survey with a question type it does not know. copilot-survey also checks what a schema cannot express (unique question ids, skip_if pointing at an earlier question, starts <= ends, at most one text question); see surveys/README.md.",
  "type": "object",
  "required": ["id", "title", "starts", "ends", "questions"],
  "additionalProperties": false,
  "properties": {
    "id": { "$ref": "#/$defs/id" },
    "series": { "$ref": "#/$defs/id", "description": "Groups the waves of one survey over time; each wave has its own id." },
    "title": { "type": "string", "minLength": 1 },
    "intro": { "type": "string", "description": "Shown before the first question." },
    "active": { "type": "boolean", "description": "Served and takes answers only when true and today is within starts-ends." },
    "nudge": { "enum": ["calm", "start", "off"], "description": "When nav-pilot brings the survey up unasked. Left out means calm." },
    "min_cli_version": { "type": "string", "pattern": "^\\d{4}\\.\\d{2}\\.\\d{2}(-\\d{6})?$", "description": "Oldest nav-pilot release (YYYY.MM.DD or YYYY.MM.DD-HHMMSS, from its tag) that gets this survey. copilot-survey leaves it out for older nav-pilot builds and for builds that send no version; the web always gets it." },
    "retention_days": { "type": "integer", "minimum": 1, "description": "Days answers are kept after the survey ends. Left out means 180." },
    "starts": { "$ref": "#/$defs/date", "description": "First day open (UTC)." },
    "ends": { "$ref": "#/$defs/date", "description": "Last day open (UTC)." },
    "questions": { "type": "array", "minItems": 1, "items": { "$ref": "#/$defs/question" }, "contains": { "required": ["other"] }, "minContains": 0, "maxContains": 3, "$comment": "At most 3 questions with other." }
  },
  "$defs": {
    "id": { "type": "string", "pattern": "^[a-z0-9][a-z0-9-]{0,62}$" },
    "date": { "type": "string", "pattern": "^\\d{4}-\\d{2}-\\d{2}$" },
    "item": {
      "type": "object",
      "required": ["id", "version", "text"],
      "additionalProperties": false,
      "properties": {
        "id": { "$ref": "#/$defs/id", "description": "Stable across waves, like a question id. The same id and version as a scale question in another wave compare." },
        "version": { "type": "integer", "minimum": 1 },
        "text": { "type": "string", "minLength": 1 },
        "construct": { "type": "string", "description": "For analysis; clients ignore it." },
        "reverse": { "type": "boolean", "description": "Agreeing is the negative end. For analysis; clients ignore it." }
      }
    },
    "question": {
      "type": "object",
      "required": ["id", "version", "type", "text"],
      "additionalProperties": false,
      "properties": {
        "id": { "$ref": "#/$defs/id", "description": "Stable across waves, never reused for another question." },
        "version": { "type": "integer", "minimum": 1, "description": "Goes up on any change that could change how people answer. Same id and version in two waves compare." },
        "type": { "enum": ["scale", "choice", "multi", "text", "matrix"] },
        "text": { "type": "string", "minLength": 1 },
        "required": { "type": "boolean" },
        "construct": { "type": "string", "description": "What the question measures. For analysis; clients ignore it." },
        "reverse": { "type": "boolean", "description": "scale: agreeing is the negative end. For analysis; clients ignore it." },
        "min": { "type": "integer", "description": "scale, matrix: lowest step. Left out means 0." },
        "max": { "type": "integer", "description": "scale, matrix: highest step, at most 10 steps above min." },
        "labels": { "type": "array", "items": { "type": "string" }, "description": "scale, matrix: one label per step, min to max." },
        "options": { "type": "array", "minItems": 2, "uniqueItems": true, "items": { "type": "string", "minLength": 1 }, "description": "choice, multi. Stored as the option text." },
        "max_choices": { "type": "integer", "minimum": 0, "description": "multi: at most this many; 0 or left out means any." },
        "exclusive": { "type": "string", "minLength": 1, "description": "multi: one of options that must be picked alone, like «I use none». Clients and server reject it together with other picks." },
        "other": { "type": "string", "minLength": 1, "description": "choice, multi: the label of one more option that takes a short free text. Choosing it stores the label as the answer, like an option; the text is sent and stored under <id>.other. Needs max_length (at most 200). Not one of options." },
        "max_length": { "type": "integer", "minimum": 1, "maximum": 2000, "description": "text, and the free text of other: in characters." },
        "items": {
          "type": "array",
          "minItems": 2,
          "items": { "$ref": "#/$defs/item" },
          "description": "matrix: statements that share its scale. Each is answered, versioned and stored as a scale question of its own, under its id; the matrix's own id and version are not stored. Item ids share the question ids' namespace."
        },
        "skip_if": {
          "type": "object",
          "description": "Skip this question (a matrix: all its items) when an earlier choice answer is, or multi answer includes, answer. With required, the question is required unless skipped.",
          "required": ["question", "answer"],
          "additionalProperties": false,
          "properties": { "question": { "$ref": "#/$defs/id" }, "answer": { "type": "string" } }
        }
      },
      "allOf": [
        {
          "if": { "properties": { "type": { "const": "scale" } } },
          "then": { "required": ["max"], "not": { "anyOf": [{ "required": ["options"] }, { "required": ["max_choices"] }, { "required": ["exclusive"] }, { "required": ["max_length"] }, { "required": ["other"] }, { "required": ["items"] }] } }
        },
        {
          "if": { "properties": { "type": { "const": "matrix" } } },
          "then": { "required": ["max", "items"], "not": { "anyOf": [{ "required": ["options"] }, { "required": ["max_choices"] }, { "required": ["exclusive"] }, { "required": ["max_length"] }, { "required": ["other"] }, { "required": ["reverse"] }] } }
        },
        {
          "if": { "properties": { "type": { "const": "choice" } } },
          "then": { "required": ["options"], "not": { "anyOf": [{ "required": ["min"] }, { "required": ["max"] }, { "required": ["labels"] }, { "required": ["reverse"] }, { "required": ["max_choices"] }, { "required": ["exclusive"] }, { "required": ["items"] }] } }
        },
        {
          "if": { "properties": { "type": { "const": "multi" } } },
          "then": { "required": ["options"], "not": { "anyOf": [{ "required": ["min"] }, { "required": ["max"] }, { "required": ["labels"] }, { "required": ["reverse"] }, { "required": ["items"] }] } }
        },
        {
          "if": { "properties": { "type": { "const": "text" } } },
          "then": { "required": ["max_length"], "not": { "anyOf": [{ "required": ["min"] }, { "required": ["max"] }, { "required": ["labels"] }, { "required": ["reverse"] }, { "required": ["options"] }, { "required": ["max_choices"] }, { "required": ["exclusive"] }, { "required": ["other"] }, { "required": ["items"] }] } }
        },
        {
          "if": { "properties": { "type": { "enum": ["choice", "multi"] } } },
          "then": {
            "if": { "required": ["other"] },
            "then": { "required": ["max_length"], "properties": { "max_length": { "maximum": 200 } } },
            "else": { "not": { "required": ["max_length"] } }
          }
        }
      ]
    }
  }
}
